Tienda,ID,Producto,Precio,imgUrl
Superama,0,salchichón san rafael bernina con jamón y pistache 200 g,38.00,http://www.superama.com.mx/Content/images/products/img_large/0750170372017L.jpg
Superama,1,centro de jamón serrano riojano  por pza,999.00,http://www.superama.com.mx/Content/images/products/img_large/0750105771068L.jpg
Superama,2,jamón alemán obertal  por kg,270.00,http://www.superama.com.mx/Content/images/products/img_large/0020553400000L.jpg
Superama,3,jamón aleman obertal por kg,280.00,http://www.superama.com.mx/Content/images/products/img_large/0020544500000L.jpg
Superama,4,jamón bonnacarne extrafino mini 800 g,125.00,http://www.superama.com.mx/Content/images/products/img_large/0750222999512L.jpg
Superama,5,jamón capistrano california por kg,84.00,http://www.superama.com.mx/Content/images/products/img_large/0020573400000L.jpg
Superama,6,jamón capistrano california por kg,84.00,http://www.superama.com.mx/Content/images/products/img_large/0750168902092L.jpg
Superama,7,jamón de pavo bernina  por kg,218.00,http://www.superama.com.mx/Content/images/products/img_large/0020357400000L.jpg
Superama,8,jamón de pavo capistrano  york por kg,174.00,http://www.superama.com.mx/Content/images/products/img_large/0020503400000L.jpg
Superama,9,jamón de pavo capistrano california por kg,92.00,http://www.superama.com.mx/Content/images/products/img_large/0750168902105L.jpg
Superama,10,jamón de pavo capistrano california por kg,92.00,http://www.superama.com.mx/Content/images/products/img_large/0020573100000L.jpg
Superama,11,jamón de pavo capistrano york por kg,174.00,http://www.superama.com.mx/Content/images/products/img_large/0750168902043L.jpg
Superama,12,jamón de pavo fud  virginia 290 g,36.00,http://www.superama.com.mx/Content/images/products/img_large/0750104000583L.jpg
Superama,13,jamón de pavo fud  virginia 3.95 kg,396.00,http://www.superama.com.mx/Content/images/products/img_large/0750104000582L.jpg
Superama,14,jamón de pavo fud  virginia por kg,100.00,http://www.superama.com.mx/Content/images/products/img_large/0020544100000L.jpg
Superama,15,jamón de pavo kurson kusher 500 g,131.00,http://www.superama.com.mx/Content/images/products/img_large/0750113450065L.jpg
Superama,16,jamón de pavo parma selección natural por kg,288.00,http://www.superama.com.mx/Content/images/products/img_large/0020532000000L.jpg
Superama,17,jamón de pavo sabori  por kg,164.00,http://www.superama.com.mx/Content/images/products/img_large/0020539600000L.jpg
Superama,18,jamón de pavo san rafael  por kg,204.00,http://www.superama.com.mx/Content/images/products/img_large/0020357500000L.jpg
Superama,19,jamón de pavo san rafael  real por kg,204.00,http://www.superama.com.mx/Content/images/products/img_large/0020590300000L.jpg
Superama,20,jamón de pavo y cerdo kir  americano por kg,84.00,http://www.superama.com.mx/Content/images/products/img_large/0020510600000L.jpg
Superama,21,jamón de pavo y cerdo kir  virginia por kg,106.00,http://www.superama.com.mx/Content/images/products/img_large/0020565500000L.jpg
Superama,22,jamón de pavo y cerdo kir  virginia por kg,106.00,http://www.superama.com.mx/Content/images/products/img_large/0750114751927L.jpg
Superama,23,jamón de pavo zwan  bienestar 250 g,43.50,http://www.superama.com.mx/Content/images/products/img_large/0750105771076L.jpg
Superama,24,jamón de pavo zwan  natural por kg,178.00,http://www.superama.com.mx/Content/images/products/img_large/0020516000000L.jpg
Superama,25,jamón de pavo zwan  virginia por kg,106.00,http://www.superama.com.mx/Content/images/products/img_large/0020520700000L.jpg
Superama,26,jamón de pierna capistrano  clásico por kg,140.00,http://www.superama.com.mx/Content/images/products/img_large/0020518400000L.jpg
Superama,27,jamón de pierna capistrano  york por kg,172.00,http://www.superama.com.mx/Content/images/products/img_large/0020368000000L.jpg
Superama,28,jamón de pierna fud  york por kg,180.00,http://www.superama.com.mx/Content/images/products/img_large/0020567400000L.jpg
Superama,29,jamón de pierna fud fino york por kg,1278.00,http://www.superama.com.mx/Content/images/products/img_large/0750104000117L.jpg
Superama,30,jamón de pierna obertal  por kg,234.00,http://www.superama.com.mx/Content/images/products/img_large/0020553500000L.jpg
Superama,31,jamón de pierna parma campestre 250 g,37.00,http://www.superama.com.mx/Content/images/products/img_large/0750151849333L.jpg
Superama,32,jamón de pierna peñaranda  kilo,292.00,http://www.superama.com.mx/Content/images/products/img_large/0020365100000L.jpg
Superama,33,jamón de pierna peñaranda  york por kg,272.00,http://www.superama.com.mx/Content/images/products/img_large/0020501800000L.jpg
Superama,34,jamón de pierna sabori  extrafino por kg,164.00,http://www.superama.com.mx/Content/images/products/img_large/0020564800000L.jpg
Superama,35,jamón de pierna san rafael  real por kg,184.00,http://www.superama.com.mx/Content/images/products/img_large/0020548100000L.jpg
Superama,36,jamón de pierna san rafael balance por kg,218.00,http://www.superama.com.mx/Content/images/products/img_large/0020548000000L.jpg
Superama,37,jamón de pierna tangamanga  listón azul por kg,206.00,http://www.superama.com.mx/Content/images/products/img_large/0020501400000L.jpg
Superama,38,jamón de pierna zwan  premium por kg,154.00,http://www.superama.com.mx/Content/images/products/img_large/0020520500000L.jpg
Superama,39,jamón de pierna zwanenberg  estilo holandés por kg,160.00,http://www.superama.com.mx/Content/images/products/img_large/0020526900000L.jpg
Superama,40,jamón holandes zwanenberg por kg,160.00,http://www.superama.com.mx/Content/images/products/img_large/0750105771001L.jpg
Superama,41,jamón ibérico bellota  loncheado 100 g,270.00,http://www.superama.com.mx/Content/images/products/img_large/0843521333200L.jpg
Superama,42,jamón ibérico señorío de olivenza  por kg,940.00,http://www.superama.com.mx/Content/images/products/img_large/0843700344536L.jpg
Superama,43,jamón iberico señorío de olivenza por kg,940.00,http://www.superama.com.mx/Content/images/products/img_large/0020576100000L.jpg
Superama,44,jamón peñaranda  a las finas hierbas 200 g,85.00,http://www.superama.com.mx/Content/images/products/img_large/0750300147594L.jpg
Superama,45,jamón peñaranda  a las finas hierbas por kg,296.00,http://www.superama.com.mx/Content/images/products/img_large/0020526000000L.jpg
Superama,46,jamón peñaranda  york 250 g,88.00,http://www.superama.com.mx/Content/images/products/img_large/0750222158008L.jpg
Superama,47,jamón selectos madariaga  bellota 100 g,286.00,http://www.superama.com.mx/Content/images/products/img_large/0843700535941L.jpg
Superama,48,jamón serrano argal  90 g,58.00,http://www.superama.com.mx/Content/images/products/img_large/0841076401402L.jpg
Superama,49,jamón serrano bernina  85 g,43.30,http://www.superama.com.mx/Content/images/products/img_large/0750104007673L.jpg
Superama,50,jamón serrano bernina  por kg,490.00,http://www.superama.com.mx/Content/images/products/img_large/0020357700000L.jpg
Superama,51,jamón serrano cumbres mayores  100 g,40.00,http://www.superama.com.mx/Content/images/products/img_large/0750300473602L.jpg
Superama,52,jamón serrano del duero por kg,464.00,http://www.superama.com.mx/Content/images/products/img_large/0020572700000L.jpg
Superama,53,jamón serrano parma  100 g,74.00,http://www.superama.com.mx/Content/images/products/img_large/0750151849135L.jpg
Superama,54,jamón serrano parma  por kg,490.00,http://www.superama.com.mx/Content/images/products/img_large/0020564100000L.jpg
Superama,55,jamón serrano peñaranda  por kg,560.00,http://www.superama.com.mx/Content/images/products/img_large/0020378800000L.jpg
Superama,56,jamón serrano riojano  loncheado 100 g,72.00,http://www.superama.com.mx/Content/images/products/img_large/0750142830110L.jpg
Superama,57,jamón serrano riojano  por kg,576.00,http://www.superama.com.mx/Content/images/products/img_large/0020576200000L.jpg
Superama,58,jamón york bonnacarne mini 800 g,128.00,http://www.superama.com.mx/Content/images/products/img_large/0750222999506L.jpg
Superama,59,chapata jamón serrano pza,35.00,http://www.superama.com.mx/Content/images/products/img_large/0020073300000L.jpg
Superama,60,marinitas   jamón y queso pieza,10.50,http://www.superama.com.mx/Content/images/products/img_large/0020059700000L.jpg
Superama,61,prosciutto peñaranda  por kg,584.00,http://www.superama.com.mx/Content/images/products/img_large/0020526200000L.jpg
Superama,62,sincronizada de queso con jamón,15.00,http://www.superama.com.mx/Content/images/products/img_large/0020921300000L.jpg
Superama,63,telelritas jamón con queso pza,10.50,http://www.superama.com.mx/Content/images/products/img_large/0020061400000L.jpg
Superama,64,jamón artesanal bellota  cortado a mano 100 g,439.00,http://www.superama.com.mx/Content/images/products/img_large/0842039152845L.jpg
Superama,65,jamón de ibérico cinco jotas  bellota  80 g,546.00,http://www.superama.com.mx/Content/images/products/img_large/0841046800137L.jpg
Superama,66,jamón de pavo capistrano  vita deli virginia por kg,108.00,http://www.superama.com.mx/Content/images/products/img_large/0020365700000L.jpg
Superama,67,jamón de pavo parma campestre virginia 250 g,34.00,http://www.superama.com.mx/Content/images/products/img_large/0750151849359L.jpg
Superama,68,jamón de pavo parma sabori virginia bajo en grasa 250 g,36.90,http://www.superama.com.mx/Content/images/products/img_large/0750151849252L.jpg
Superama,69,jamón de pavo san rafael delicatessen 300 g,55.50,http://www.superama.com.mx/Content/images/products/img_large/0750104000030L.jpg
Superama,70,jamón de pavo san rafael delicatessen fino por kg,714.00,http://www.superama.com.mx/Content/images/products/img_large/0000007501383L.jpg
Superama,71,jamón de pavo y cerdo capistrano  americano clásico por kg,140.00,http://www.superama.com.mx/Content/images/products/img_large/0020353900000L.jpg
Superama,72,jamón de pavo y cerdo zwan  premium virginia por kg,88.00,http://www.superama.com.mx/Content/images/products/img_large/0020516100000L.jpg
Superama,73,jamón de pavo zwan premium virginia 250 g,31.90,http://www.superama.com.mx/Content/images/products/img_large/0750105771015L.jpg
Superama,74,jamón de pechuga de pavo bonnacarne mini 800 g,128.00,http://www.superama.com.mx/Content/images/products/img_large/0750222999509L.jpg
Superama,75,jamón de pierna parma gran reserva horneado por kg,282.00,http://www.superama.com.mx/Content/images/products/img_large/0020519500000L.jpg
Superama,76,jamón de pierna san rafael  real 300 g,55.50,http://www.superama.com.mx/Content/images/products/img_large/0750104000489L.jpg
Superama,77,jamón de pierna san rafael balance 250 g,62.00,http://www.superama.com.mx/Content/images/products/img_large/0750104000323L.jpg
Superama,78,jamón de pierna san rafael bernina americano por kg,286.00,http://www.superama.com.mx/Content/images/products/img_large/0020386500000L.jpg
Superama,79,jamón de pierna san rafael bernina estilo holandés 300 g,92.50,http://www.superama.com.mx/Content/images/products/img_large/0750170373042L.jpg
Superama,80,jamón de pierna san rafael bernina estilo holandés por kg,284.00,http://www.superama.com.mx/Content/images/products/img_large/0020523000000L.jpg
Superama,81,jamón de pierna san rafael bernina york 250 g,82.50,http://www.superama.com.mx/Content/images/products/img_large/0750104007676L.jpg
Superama,82,jamón de pierna san rafael bernina york por kg,272.00,http://www.superama.com.mx/Content/images/products/img_large/0750104007668L.jpg
Superama,83,jamón de pierna san rafael bernina york por kg,272.00,http://www.superama.com.mx/Content/images/products/img_large/0020357300000L.jpg
Superama,84,jamón de pierna zwan premium rebanadas finas 250 g,46.00,http://www.superama.com.mx/Content/images/products/img_large/0750105771050L.jpg
Superama,85,jamón ibérico bellótero  premium artesanal 100 g,455.00,http://www.superama.com.mx/Content/images/products/img_large/0842535898745L.jpg
Superama,86,jamón ibérico extra special  rebanado 100 g,119.00,http://www.superama.com.mx/Content/images/products/img_large/0750179164088L.jpg
Superama,87,jamón oscar mayer  cocido ahumado 340 g,97.00,http://www.superama.com.mx/Content/images/products/img_large/0004470006632L.jpg
Superama,88,jamón paleta de jabugo bellota bellótero  pata negra artesanal 100 g,360.00,http://www.superama.com.mx/Content/images/products/img_large/0842535898897L.jpg
Superama,89,jamón serrano bellótero  curado artesano 150 g,249.00,http://www.superama.com.mx/Content/images/products/img_large/0841097305749L.jpg
Superama,90,jamón serrano cumbres mayores  en cuadritos 200 g,40.00,http://www.superama.com.mx/Content/images/products/img_large/0750300473608L.jpg
Superama,91,jamón serrano cumbres mayores  reserva 100 g,62.00,http://www.superama.com.mx/Content/images/products/img_large/0750300473616L.jpg
Superama,92,jamón serrano extra special  de cerdo de raza duroc 3 pzas,149.00,http://www.superama.com.mx/Content/images/products/img_large/0750179163626L.jpg
Superama,93,jamón serrano parma  español premium 120 g,97.00,http://www.superama.com.mx/Content/images/products/img_large/0750151849136L.jpg
Superama,94,jamón serrano real ibérico  español 100 g,39.00,http://www.superama.com.mx/Content/images/products/img_large/0842151124586L.jpg
Superama,95,jamón serrano redondo iglesias añejo selección 100 g,67.50,http://www.superama.com.mx/Content/images/products/img_large/0842791900000L.jpg
Superama,96,jamón serrano san rafael tangamanga gran reserva de españa 100 g,72.00,http://www.superama.com.mx/Content/images/products/img_large/0750104005196L.jpg
Superama,97,jamón serrano san rafael tangamanga sin cuero por kg,580.00,http://www.superama.com.mx/Content/images/products/img_large/0020551000000L.jpg
Superama,98,rollo de queso con jamón serrano san jacinto  340 g,96.00,http://www.superama.com.mx/Content/images/products/img_large/0750300589816L.jpg
Superama,99,"trío español argal  jamón serrano, chorizo pamplona y salchichón 150 g",87.00,http://www.superama.com.mx/Content/images/products/img_large/0841076401401L.jpg
Superama,100,charola parma  de jamón serrano  150 g,97.00,http://www.superama.com.mx/Content/images/products/img_large/0750151849165L.jpg
Superama,101,jamón de pavo sabori  virginia por kg,100.00,http://www.superama.com.mx/Content/images/products/img_large/0020562300000L.jpg
Superama,102,jamón martiko curado de pato 100 g,249.00,http://www.superama.com.mx/Content/images/products/img_large/0841254000608L.jpg
Superama,103,paleta ibérica jabugo  100 g,199.00,http://www.superama.com.mx/Content/images/products/img_large/0843521333205L.jpg
Superama,104,prosciutto daniele  100 g,94.00,http://www.superama.com.mx/Content/images/products/img_large/0073643685115L.jpg
Superama,105,selección de carnes real ibérico 200 g,73.00,http://www.superama.com.mx/Content/images/products/img_large/0842151100100L.jpg
Superama,106,submarino con jamón pza,35.00,http://www.superama.com.mx/Content/images/products/img_large/0020962100000L.jpg
Superama,107,aceitunas serpis sabores rellenas de jamón serrano 300 g,38.00,http://www.superama.com.mx/Content/images/products/img_large/0841034490008L.jpg
Superama,108,aceitunas verdes jolca  rellenas de jamón serrano 300 g,27.00,http://www.superama.com.mx/Content/images/products/img_large/0841066702017L.jpg
Superama,109,lonchado de paleta de cerdo cinco jotas  pata negra 80 g,359.00,http://www.superama.com.mx/Content/images/products/img_large/0841046800316L.jpg
Superama,110,loncheado de presa de cerdo cinco jotas  80 g,340.00,http://www.superama.com.mx/Content/images/products/img_large/0841046800207L.jpg
Superama,111,papas sabritas gourmet sabor jamón serrano 150 g,36.00,http://www.superama.com.mx/Content/images/products/img_large/0750101113130L.jpg
Superama,112,paté hígado de cerdo louriño  de jamón 125 g,37.00,http://www.superama.com.mx/Content/images/products/img_large/0841176950005L.jpg
Superama,113,pechuga de pavo fud  250 g,40.00,http://www.superama.com.mx/Content/images/products/img_large/0750104000116L.jpg
Superama,114,pechuga de pavo san rafael  clásica 250 g,62.00,http://www.superama.com.mx/Content/images/products/img_large/0750104000012L.jpg
Superama,115,pechuga de pavo san rafael balance 250 g,55.00,http://www.superama.com.mx/Content/images/products/img_large/0750104000159L.jpg
Superama,116,pechuga de pavo san rafael bernina sin sal 200 g,84.50,http://www.superama.com.mx/Content/images/products/img_large/0750104007675L.jpg
Superama,117,pechuga de pavo tangamanga  250 g,89.50,http://www.superama.com.mx/Content/images/products/img_large/0750157625155L.jpg
Superama,118,pechuga de pavo san rafael bernina cocida y ahumada 300 g,113.00,http://www.superama.com.mx/Content/images/products/img_large/0750170373090L.jpg
La Comer,0,Racion jamon iberico   sierra del jamon,265.00,https://www.lacomer.com.mx/superc/img_art/8435213312008_3.jpg
La Comer,1,Jamon serrano serrano coren,72.00,https://www.lacomer.com.mx/superc/img_art/8411769180452_3.jpg
La Comer,2,Jamon horneado kir,97.90,https://www.lacomer.com.mx/superc/img_art/2621029000000_3.jpg
La Comer,3,Jamon de pierna horneado sin sal   penaranda,300.00,https://www.lacomer.com.mx/superc/img_art/2623630000004_3.jpg
La Comer,4,Pate de jamon lourio lourino,47.00,https://www.lacomer.com.mx/superc/img_art/8411769500052_3.jpg
La Comer,5,Jamon pavo yarden,120.38,https://www.lacomer.com.mx/superc/img_art/7501134500655_3.jpg
La Comer,6,Baguette jamon de pavo    ,34.50,https://www.lacomer.com.mx/superc/img_art/2655763000002_3.jpg
La Comer,7,Croquetas de jamon   f/m,110.00,https://www.lacomer.com.mx/superc/img_art/2650466000007_3.jpg
La Comer,8,Jamon virginia bafar,106.00,https://www.lacomer.com.mx/superc/img_art/2620144000001_3.jpg
La Comer,9,Racion jamon iberico   sierra del jamon,265.00,https://www.lacomer.com.mx/superc/img_art/8435213312008_3.jpg
La Comer,10,Jamon serrano serrano coren,72.00,https://www.lacomer.com.mx/superc/img_art/8411769180452_3.jpg
La Comer,11,Jamon horneado kir,97.90,https://www.lacomer.com.mx/superc/img_art/2621029000000_3.jpg
La Comer,12,Jamon de pierna horneado sin sal   penaranda,300.00,https://www.lacomer.com.mx/superc/img_art/2623630000004_3.jpg
La Comer,13,Pate de jamon lourio lourino,47.00,https://www.lacomer.com.mx/superc/img_art/8411769500052_3.jpg
La Comer,14,Jamon pavo yarden,120.38,https://www.lacomer.com.mx/superc/img_art/7501134500655_3.jpg
La Comer,15,Baguette jamon de pavo    ,34.50,https://www.lacomer.com.mx/superc/img_art/2655763000002_3.jpg
La Comer,16,Croquetas de jamon   f/m,110.00,https://www.lacomer.com.mx/superc/img_art/2650466000007_3.jpg
La Comer,17,Jamon virginia bafar,106.00,https://www.lacomer.com.mx/superc/img_art/2620144000001_3.jpg
La Comer,18,Jamon gran reserva   parma,280.00,https://www.lacomer.com.mx/superc/img_art/7501518491920_3.jpg
La Comer,19,Jamon de pavo  sabori a granel . sabori,150.00,https://www.lacomer.com.mx/superc/img_art/7501518492187_3.jpg
La Comer,20,Jamon serrano san rafael,66.00,https://www.lacomer.com.mx/superc/img_art/75014391_3.jpg
La Comer,21,Jamon gran reserva   parma,280.00,https://www.lacomer.com.mx/superc/img_art/2624855000008_3.jpg
La Comer,22,Jamon de pavo  sabori a granel . sabori,150.00,https://www.lacomer.com.mx/superc/img_art/2622451000002_3.jpg
La Comer,23,Jamon   virginia  campestre . campestre,107.00,https://www.lacomer.com.mx/superc/img_art/2622881000009_3.jpg
La Comer,24,Sandwich jamon de pavo    ,28.00,https://www.lacomer.com.mx/superc/img_art/2655749000002_3.jpg
La Comer,25,Jamon serrano prosciuto mastro,493.00,https://www.lacomer.com.mx/superc/img_art/2621268000007_3.jpg
La Comer,26,Jamon a las finas hierbas   penaranda,304.00,https://www.lacomer.com.mx/superc/img_art/2624209000005_3.jpg
La Comer,27,Jamon sabor tocino lata   spam,59.97,https://www.lacomer.com.mx/superc/img_art/37600336581_3.jpg
La Comer,28,Jamon pierna fino kir,126.00,https://www.lacomer.com.mx/superc/img_art/7501147514571_3.jpg
La Comer,29,Jamon pierna fino kir,126.00,https://www.lacomer.com.mx/superc/img_art/2621027000002_3.jpg
La Comer,30,Jamon   virginia  campestre . campestre,107.00,https://www.lacomer.com.mx/superc/img_art/7501518493139_3.jpg
La Comer,31,Jamon americano   bafar,21.00,https://www.lacomer.com.mx/superc/img_art/7501518482072_3.jpg
La Comer,32,Jamon serrano    la espanola,61.90,https://www.lacomer.com.mx/superc/img_art/7501392227226_3.jpg
La Comer,33,Jamon de jabugo bellotero   bellotero,452.00,https://www.lacomer.com.mx/superc/img_art/8420391528457_3.jpg
La Comer,34,Jamon cocido ahumado oscar mayer,92.50,https://www.lacomer.com.mx/superc/img_art/44700066324_3.jpg
La Comer,35,Sandwich jamon serrano    ,30.00,https://www.lacomer.com.mx/superc/img_art/2655751000007_3.jpg
La Comer,36,Jamon virginia mixto   fud,125.97,https://www.lacomer.com.mx/superc/img_art/2620854000001_3.jpg
La Comer,37,Jamon horneado fud,104.00,https://www.lacomer.com.mx/superc/img_art/7501040001130_3.jpg
La Comer,38,Jamon serrano espanol   redondo iglesias   redondo iglesias,72.00,https://www.lacomer.com.mx/superc/img_art/8427919000006_3.jpg
La Comer,39,Pate de jamon serrano frasco novelda,38.00,https://www.lacomer.com.mx/superc/img_art/8411055002451_3.jpg
La Comer,40,Jamon a las finas hierbas   penaranda,304.00,https://www.lacomer.com.mx/superc/img_art/7502221580147_3.jpg
La Comer,41,Jamon de pierna virginia   fud,52.00,https://www.lacomer.com.mx/superc/img_art/7501040001918_3.jpg
La Comer,42,Jamon virginia mixto   kir,104.90,https://www.lacomer.com.mx/superc/img_art/2624931000007_3.jpg
La Comer,43,Jamon serrano   casademont,60.00,https://www.lacomer.com.mx/superc/img_art/8411034156397_3.jpg
La Comer,44,Pechuga rellena de queso / jamon    ,82.90,https://www.lacomer.com.mx/superc/img_art/2611861000009_3.jpg
La Comer,45,Jamon iberico con hueso   5j,2258.00,https://www.lacomer.com.mx/superc/img_art/8410468010114_3.jpg
La Comer,46,Jamon horneado kir,97.90,https://www.lacomer.com.mx/superc/img_art/7501147515592_3.jpg
La Comer,47,Jamon york penaranda,288.00,https://www.lacomer.com.mx/superc/img_art/7503001475332_3.jpg
La Comer,48,Jamon virginia bafar,106.00,https://www.lacomer.com.mx/superc/img_art/7501518460421_3.jpg
La Comer,49,Jamon de pierna horneado sin sal   penaranda,300.00,https://www.lacomer.com.mx/superc/img_art/7503001475813_3.jpg
La Comer,50,Jamon serrano reserva   torre vieja,521.00,https://www.lacomer.com.mx/superc/img_art/74570683_3.jpg
La Comer,51,Jamon pavo san rafael,208.00,https://www.lacomer.com.mx/superc/img_art/75013837_3.jpg
La Comer,52,Jamon serrano premium   parma,91.00,https://www.lacomer.com.mx/superc/img_art/7501518491364_3.jpg
La Comer,53,Empanadas jamon y queso est. argentino   confetti,65.00,https://www.lacomer.com.mx/superc/img_art/7503007077295_3.jpg
La Comer,54,Jamon curado de regalo   espaa e hijos,665.00,https://www.lacomer.com.mx/superc/img_art/8428204007434_3.jpg
La Comer,55,Baguette jamon de pierna    ,34.50,https://www.lacomer.com.mx/superc/img_art/2655765000000_3.jpg
La Comer,56,Jamon del diablo lata herdez,44.70,https://www.lacomer.com.mx/superc/img_art/7501003130228_3.jpg
La Comer,57,Jamon serrano prosciuto mastro,493.00,https://www.lacomer.com.mx/superc/img_art/3662472_3.jpg
La Comer,58,Jamon virginia bafar paq. 200gr   bafar,33.00,https://www.lacomer.com.mx/superc/img_art/7501518463156_3.jpg
La Comer,59,Bernina jamon estilo holandes 300 gr holandes bernina,80.04,https://www.lacomer.com.mx/superc/img_art/7501703730421_3.jpg
La Comer,60,Jamon americano fud,101.57,https://www.lacomer.com.mx/superc/img_art/7501040001086_3.jpg
La Comer,61,Jamon iberico con hueso   5j,2258.00,https://www.lacomer.com.mx/superc/img_art/2623899000005_3.jpg
La Comer,62,Jamon york penaranda,288.00,https://www.lacomer.com.mx/superc/img_art/2621523000001_3.jpg
La Comer,63,Jamon del diablo de pavo lata herdez,43.80,https://www.lacomer.com.mx/superc/img_art/7501003130259_3.jpg
La Comer,64,Fud jamon horneado de pierna de pierna fud,94.00,https://www.lacomer.com.mx/superc/img_art/7501040002908_3.jpg
La Comer,65,Sandwich jamon de pierna    ,28.00,https://www.lacomer.com.mx/superc/img_art/2655748000003_3.jpg
La Comer,66,Baguette jamon serrano    ,36.00,https://www.lacomer.com.mx/superc/img_art/2655766000009_3.jpg
La Comer,67,Gourmet papas fritas jamon serrano   sabritas,38.00,https://www.lacomer.com.mx/superc/img_art/7501011131309_3.jpg
La Comer,68,Jamon spam lite   hormel,66.00,https://www.lacomer.com.mx/superc/img_art/37600400701_3.jpg
La Comer,69,Jamon de pato fileteado   martiko,234.66,https://www.lacomer.com.mx/superc/img_art/8412540006084_3.jpg
La Comer,70,Jamon americano   kir,18.90,https://www.lacomer.com.mx/superc/img_art/7501147513291_3.jpg
La Comer,71,Jamon serrano   7 hermanos,73.33,https://www.lacomer.com.mx/superc/img_art/8421195216571_3.jpg
La Comer,72,Papilla jamon con verduras et.3 gerber,13.65,https://www.lacomer.com.mx/superc/img_art/7501000906260_3.jpg
La Comer,73,Campestre parma jamon virginia de pavo virginia de pavo campestre,29.00,https://www.lacomer.com.mx/superc/img_art/7501518493597_3.jpg
La Comer,74,Jamon serrano espanol pza   tangamanga,86.00,https://www.lacomer.com.mx/superc/img_art/7501040051968_3.jpg
La Comer,75,Jamon cocido de pavo a granel   duby,59.90,https://www.lacomer.com.mx/superc/img_art/7501147529124_3.jpg
La Comer,76,Jamon serrano baby      venancio y pilar   venancio y pilar,642.70,https://www.lacomer.com.mx/superc/img_art/2624115000007_3.jpg
La Comer,77,Jamon york obertal,248.10,https://www.lacomer.com.mx/superc/img_art/2621437000005_3.jpg
La Comer,78,Jamon serrano baby      venancio y pilar   venancio y pilar,642.70,https://www.lacomer.com.mx/superc/img_art/71776156_3.jpg
La Comer,79,Jamon real de pavo   san rafael,56.00,https://www.lacomer.com.mx/superc/img_art/7501040000300_3.jpg
La Comer,80,Sabori jamon virginia de pavo virginia de pavo sabori,30.00,https://www.lacomer.com.mx/superc/img_art/7501518492521_3.jpg
